time,text,url
Thu Sep 30 15:40:29 +0000 2021,"#CongressVsVadras | Captain Amarinder to quit Congress, even as G23 takes on Vadras; Tune in to watch The Debate wi… https://t.co/scNGShkbx3",https://twitter.com/i/web/status/1443601652607447048
Thu Sep 30 15:35:34 +0000 2021,"#HasParamBirFled | The Debate with Arnab is now #LIVE, on-air and online, here - https://t.co/3AdouRdizw https://t.co/KSqv1VRa6J",https://www.youtube.com/watch?v=xtoOK86mW8Y
Thu Sep 30 15:27:02 +0000 2021,Adani Green Energy acquires 40MW Solar Asset in Odisha; signs definitive agreements https://t.co/4levSBY2JB,https://www.republicworld.com/india-news/general-news/adani-green-energy-acquires-40mw-solar-asset-in-odisha-signs-definitive-agreements.html
Thu Sep 30 15:16:45 +0000 2021,Two Hindu Sena members who allegedly vandalized Owaisi's house granted bail by Delhi Court https://t.co/FIHgJ0ybgo,https://www.republicworld.com/india-news/general-news/two-hindu-sena-members-who-allegedly-vandalized-owaisis-house-granted-bail-by-delhi-court.html
Thu Sep 30 15:11:04 +0000 2021,Who is Air Chief Marshal RKS Bhadauria? Everything to know about ex-IAF Chief https://t.co/FdSuIAR9hz,https://www.republicworld.com/india-news/general-news/who-is-air-chief-marshal-rks-bhadauria-everything-to-know-about-ex-iaf-chief.html
Thu Sep 30 15:06:07 +0000 2021,"Chidambaram breaks silence, 'hurt' over Congress workers protesting against Kapil Sibal https://t.co/Lz7ntY0GHK",https://www.republicworld.com/india-news/politics/chidambaram-breaks-silence-hurt-over-congress-workers-protesting-against-kapil-sibal.html
Thu Sep 30 14:53:20 +0000 2021,'That's CM’s prerogative': Capt Amarinder questions Sidhu's interference in govt affairs https://t.co/gu1robh8tT,https://www.republicworld.com/india-news/politics/thats-cms-prerogative-capt-amarinder-questions-sidhus-interference-in-govt-affairs.html
Thu Sep 30 14:50:38 +0000 2021,Fact Check: Is UPSC officially on Twitter? Government clarifies https://t.co/45NwuVoXxQ,https://www.republicworld.com/fact-check/viral/fact-check-is-upsc-officially-on-twitter-government-clarifies.html
Thu Sep 30 14:24:15 +0000 2021,#HasParamBirFled ? | 'Serving DG Home Guard (Param Bir) makes allegations against then Maha Home Minister; Why Maha… https://t.co/23bOTQwkYx,https://twitter.com/i/web/status/1443582470054498308
Thu Sep 30 14:22:40 +0000 2021,"Punjab Crisis LIVE Updates: Amid crisis, Congress to convene CWC meeting

https://t.co/8Gfr4OX13a",https://www.republicworld.com/india-news/politics/punjab-crisis-live-updates-amarinder-says-hes-quitting-congress-but-not-joining-bjp.html
Thu Sep 30 14:20:57 +0000 2021,IN PICS | IAF Chief Bhadauria retires; Air Chief Marshal VR Chaudhari takes over command https://t.co/w34SLefCgE,https://www.republicworld.com/india-news/general-news/in-pics-iaf-chief-bhadauria-retires-air-chief-marshal-vr-chaudhari-takes-over-command-imageid-1.html
Thu Sep 30 14:11:41 +0000 2021,#HasParamBirFled ? | 'Where is Anil Deshmukh &amp; Anil Parab?; they've been summoned but not appeared before courts. B… https://t.co/KfHPm0VhE4,https://twitter.com/i/web/status/1443579307201232908
Thu Sep 30 14:03:37 +0000 2021,#HasParamBirFled ? | 'We suspect he (Param Bir) was sent abroad on the orders of Central Govt': Nana Patole of Cong… https://t.co/yO8z4Pbg9K,https://twitter.com/i/web/status/1443577274914140166
Thu Sep 30 13:57:25 +0000 2021,"Gorakhpur: Deceased's wife exerts confidence in UP CM, says request for CBI probe accepted https://t.co/wxkLREp3vP",https://www.republicworld.com/india-news/general-news/gorakhpur-deceaseds-wife-exerts-confidence-in-up-cm-says-request-for-cbi-probe-accepted.html
Thu Sep 30 13:49:59 +0000 2021,#HasParamBirFled ? | BJP refutes Congress accusations of assisting Param Bir to flee the country; puts onus on Maha… https://t.co/s3stiUBRhH,https://twitter.com/i/web/status/1443573843835060244
Thu Sep 30 13:48:04 +0000 2021,ZyCoV-D to be introduced in Covid vaccination drive shortly: Government https://t.co/DXhEJni4cY,https://www.republicworld.com/india-news/general-news/zycov-d-to-be-introduced-in-covid-vaccination-drive-shortly-government.html
Thu Sep 30 13:43:04 +0000 2021,#HasParamBirFled ? | Congress accuses Central Government of assisting Param Bir Singh to flee the country. Watch… https://t.co/pImiNBSIBe,https://twitter.com/i/web/status/1443572102787829766
Thu Sep 30 13:39:39 +0000 2021,#HasParamBirFled ? | 'Person facing criminal cases flees country then courts should take cognisance; it's surprisin… https://t.co/pVRNSM3I2X,https://twitter.com/i/web/status/1443571245954469890
Thu Sep 30 13:34:45 +0000 2021,#HasParamBirFled ? | Sources claim Param Bir Singh fled out of the country through a private aircraft. Watch… https://t.co/4R8A0Bzrw1,https://twitter.com/i/web/status/1443570011260346375
Thu Sep 30 13:28:31 +0000 2021,Amarinder Singh vows to beat Navjot Sidhu in 2022 polls; says 'he's not right for Punjab' https://t.co/pBPH1xqBdO,https://www.republicworld.com/india-news/politics/amarinder-singh-vows-to-beat-navjot-sidhu-in-2022-polls-says-hes-not-right-for-punjab.html
Thu Sep 30 13:26:33 +0000 2021,"Param Bir Singh may have fled India, suspects Maharashtra HM Patil; 'in touch with Centre' https://t.co/ugHJLQl4JG",https://www.republicworld.com/india-news/general-news/param-bir-singh-may-have-fled-india-suspects-maharashtra-hm-patil-in-touch-with-centre.html
Thu Sep 30 13:20:51 +0000 2021,#BREAKING | 'Permission of the CM and the state government is necessary for any government official of the state to… https://t.co/pZjjuz5ReU,https://twitter.com/i/web/status/1443566512107778048
Thu Sep 30 13:20:14 +0000 2021,"In tug-of-war to remain Chhattisgarh CM, Baghel calls Kabil Sibal's remarks 'unfortunate' https://t.co/9uCAtrPtTJ",https://www.republicworld.com/india-news/politics/in-tug-of-war-to-remain-chhattisgarh-cm-baghel-calls-kabil-sibals-remarks-unfortunate.html
Thu Sep 30 13:17:14 +0000 2021,#BREAKING | 'There are inputs that Param Bir Singh may have left the country': Maharashtra Home Minister Dilip Wals… https://t.co/ltsdzdAUt6,https://twitter.com/i/web/status/1443565601813794820
Thu Sep 30 13:15:39 +0000 2021,#BREAKING | Maharashtra Home Ministry suspects Ex-Commissioner of Mumbai Police Param Bir Singh has fled abroad. Tu… https://t.co/ihQdt0sG1B,https://twitter.com/i/web/status/1443565204034387970
Thu Sep 30 13:07:29 +0000 2021,Bhabanipur Bypoll: Heated scuffle breaks out between TMC &amp; BJP workers; car vandalised https://t.co/7RAW10YwKS,https://www.republicworld.com/india-news/politics/bhabanipur-bypoll-heated-scuffle-breaks-out-between-tmc-and-bjp-workers-car-vandalised.html
Thu Sep 30 13:04:39 +0000 2021,#BREAKING | Charanjit Channi leaves immediately after the meeting; Navjot Sidhu leaves half an hour later. Cong Hig… https://t.co/FIxLzCLre9,https://twitter.com/i/web/status/1443562436989128704
Thu Sep 30 13:02:41 +0000 2021,#BREAKING | Navjot Sidhu leaves Punjab Bhawan half-an-hour after Punjab CM Charanjit Channi; doesn't speak to media… https://t.co/CcWQD7SbNm,https://twitter.com/i/web/status/1443561940047970304
Thu Sep 30 12:57:20 +0000 2021,"'Sidhu not the right man for Punjab; wherever he fights from, I won't let him win': Captain Amarinder Singh. Watch… https://t.co/efL6ph8rZj",https://twitter.com/i/web/status/1443560594511040516
Thu Sep 30 12:56:17 +0000 2021,"'Neither remaining in Congress, nor joining BJP': Captain Amarinder Singh. Watch here https://t.co/oefJxIhn1D https://t.co/SMFPTHPBFJ",http://youtube.com/watch?v=xtoOK86mW8Y
Thu Sep 30 12:55:21 +0000 2021,#LIVE | Captain Amarinder Singh addresses press conference after his arrival in Chandigarh. Watch here… https://t.co/fqDGeAitpF,https://twitter.com/i/web/status/1443560097502748677
Thu Sep 30 12:54:25 +0000 2021,"#BREAKING | Captain Amarinder Singh arrives at Chandigarh after his crucial visit to Delhi, involving high profile… https://t.co/snooeWGwfX",https://twitter.com/i/web/status/1443559860205875206
Thu Sep 30 12:54:01 +0000 2021,Punjab CM Channi offers Navjot Sidhu a truce formula; Congress ropes in mediator Rawat  https://t.co/2ksXcH4OKA,https://www.republicworld.com/india-news/politics/punjab-cm-channi-offers-navjot-sidhu-a-truce-formula-congress-ropes-in-mediator-rawat.html
Thu Sep 30 12:52:04 +0000 2021,"Digvijaya Singh acknowledges help by RSS workers, Amit Shah during his Narmada pilgrimage https://t.co/RqvwRyeA78",https://www.republicworld.com/india-news/general-news/digvijaya-singh-acknowledges-help-by-rss-workers-amit-shah-during-his-narmada-pilgrimage.html
Thu Sep 30 12:50:52 +0000 2021,#BREAKING | Congress High Command asks Harish Rawat to mediate between Punjab CM Charanjit Channi and Navjot Sidhu:… https://t.co/9pSHyeZvCn,https://twitter.com/i/web/status/1443558967498608642
Thu Sep 30 12:48:00 +0000 2021,Congress G23 neta Kurien slams seniors' sidelining; says ‘depending on youth detrimental' https://t.co/ioSySTao3l,https://www.republicworld.com/india-news/politics/congress-g23-neta-kurien-slams-seniors-sidelining-says-depending-on-youth-detrimental.html
Thu Sep 30 12:45:32 +0000 2021,"Why India needs to enhance, expand and modernise the defence sector, Maj Gen GD Bakshi (Retd.) explains in the 2nd… https://t.co/hNcKajBYF2",https://twitter.com/i/web/status/1443557624167817219
Thu Sep 30 12:43:26 +0000 2021,Republic Top 10 Headlines: Punjab Congress rift; IAF Chief RKS Bhadauria retires &amp; more https://t.co/kFzINzhRi5,https://www.republicworld.com/india-news/general-news/republic-top-10-headlines-punjab-congress-rift-iaf-chief-rks-bhadauria-retires-and-more.html
Thu Sep 30 12:38:20 +0000 2021,NCW takes cognizance after rape survivor IAF officer subjected to banned two-finger test https://t.co/IJ9Atr0Fco,https://www.republicworld.com/india-news/general-news/ncw-takes-cognizance-after-rape-survivor-iaf-officer-subjected-to-banned-two-finger-test.html
Thu Sep 30 12:36:13 +0000 2021,Crucial Channi-Sidhu meet concludes; CM Channi offers truce formula to Sidhu. CM leaves Punjab Bhawan after meeting… https://t.co/pPM2M3ZH7u,https://twitter.com/i/web/status/1443555279040249859
Thu Sep 30 12:29:58 +0000 2021,#BREAKING | Punjab CM Charanjit Channi leaves Punjab Bhawan after his meeting with Navjot Sidhu concludes. Watch… https://t.co/HtlyCSGcU9,https://twitter.com/i/web/status/1443553708818636810
Thu Sep 30 12:25:21 +0000 2021,"CBSE class 10th result 2021 for compartment, private and special exams, here's direct link https://t.co/80eK4uikjF",https://www.republicworld.com/india-news/education/cbse-class-10th-result-2021-for-compartment-private-and-special-exams-heres-direct-link.html
Thu Sep 30 12:22:02 +0000 2021,J&amp;K Lakes &amp; Waterways Dev Authority's short-name sparks Twitter trend; Singhvi has advice https://t.co/2XygfCImM1,https://www.republicworld.com/india-news/general-news/j-and-k-lakes-and-waterways-dev-authoritys-short-name-sparks-twitter-trend-singhvi-has-advice.html
Thu Sep 30 12:14:06 +0000 2021,"Amarinder Singh may float new pro-Punjab, nationalist party; talking to like-minded others https://t.co/4R3sdenzRB",https://www.republicworld.com/india-news/politics/amarinder-singh-may-float-new-pro-punjab-nationalist-party-talking-to-like-minded-others.html
Thu Sep 30 12:10:00 +0000 2021,"Bhabanipur: Priyanka Tibrewal accuses TMC's Madan Mitra of shutting down EVM, buying votes https://t.co/y3HH3a78zy",https://www.republicworld.com/india-news/politics/bhabanipur-priyanka-tibrewal-accuses-tmcs-madan-mitra-of-shutting-down-evm-buying-votes.html
Thu Sep 30 12:06:18 +0000 2021,#BREAKING | Captain Amarinder Singh to float his own outfit; Captain talking to like-minded parties: Captain camp s… https://t.co/VNLJn27hKh,https://twitter.com/i/web/status/1443547752542060544
Thu Sep 30 12:05:59 +0000 2021,DDMA bans Chhat Pooja celebrations in public places in Delhi due to COVID restrictions https://t.co/r9xsFaG4Qy,https://www.republicworld.com/india-news/city-news/ddma-bans-chhat-pooja-celebrations-in-public-places-in-delhi-due-to-covid-restrictions.html
Thu Sep 30 11:54:37 +0000 2021,Impressed Brian Lara hails Glenn Maxwell's turnaround; credits Virat Kohli for his success https://t.co/xknHyrHgtc,https://www.republicworld.com/sports-news/cricket-news/impressed-brian-lara-hails-glenn-maxwells-turnaround-credits-virat-kohli-for-his-success.html
Thu Sep 30 11:54:01 +0000 2021,Punjab CM Charanjit Channi calls for the cabinet meeting on October 4 even as his meeting with Navjot Sidhu is unde… https://t.co/LmbkeI65WK,https://twitter.com/i/web/status/1443544659049910280
Thu Sep 30 11:51:14 +0000 2021,"Jitin Prasada says Congress wants those 'working to break India', not Captain Amarinder https://t.co/FLMKXpf3jo",https://www.republicworld.com/india-news/politics/jitin-prasada-says-congress-wants-those-working-to-break-india-not-captain-amarinder.html
Thu Sep 30 11:50:15 +0000 2021,Ghulam Nabi Azad condemns Congress hooliganism at Kapil Sibal's home; schools high command https://t.co/MuY18kyb7w,https://www.republicworld.com/india-news/politics/ghulam-nabi-azad-condemns-congress-hooliganism-at-kapil-sibals-home-schools-high-command.html
Thu Sep 30 11:48:24 +0000 2021,"As 'MS Dhoni: The Untold Story' turns 5, fans pay tribute to Sushant Singh Rajput
https://t.co/jG4TKpwgZ2",https://www.republicworld.com/entertainment-news/bollywood-news/as-ms-dhoni-the-untold-story-turns-5-fans-pay-tribute-to-sushant-singh-rajput.html
Thu Sep 30 11:43:02 +0000 2021,"Punjab Crisis LIVE Updates: Channi stands ground against Sidhu; refuses to change DGP &amp; AG

https://t.co/8Gfr4OX13a",https://www.republicworld.com/india-news/politics/punjab-crisis-live-updates-amarinder-says-hes-quitting-congress-but-not-joining-bjp.html
Thu Sep 30 11:38:58 +0000 2021,"CBSE Class 10 compartment result 2021 declared, here's how to check on Digi locker https://t.co/fhNhbBXtuF",https://www.republicworld.com/india-news/education/cbse-class-10-compartment-result-2021-declared-heres-how-to-check-on-digi-locker.html
Thu Sep 30 11:38:50 +0000 2021,Republic gets inside details from Channi-Sidhu meeting; Charanjit Channi refuses to overturn key appointments while… https://t.co/bLfRXZ9dl9,https://twitter.com/i/web/status/1443540841021145092
Thu Sep 30 11:31:49 +0000 2021,Power Ministry reveals new guidelines to support flood moderation in Hydropower Projects https://t.co/1rDJokDMct,https://www.republicworld.com/india-news/general-news/power-ministry-reveals-new-guidelines-to-support-flood-moderation-in-hydropower-projects.html
Thu Sep 30 11:27:28 +0000 2021,Delhi HC rejects Avantha Group promoter Thapar's plea challenging ED arrest https://t.co/5y0hCGUnR6,https://www.republicworld.com/india-news/general-news/delhi-hc-rejects-avantha-group-promoter-thapars-plea-challenging-ed-arrest.html
Thu Sep 30 11:24:24 +0000 2021,#BREAKING | Big political development from Punjab CM Charanjit Channi's meeting with Navjot Sidhu. #Watch fast-pace… https://t.co/iFhQQTMpY6,https://twitter.com/i/web/status/1443537208405676036
Thu Sep 30 11:22:09 +0000 2021,Capt Amarinder Singh removes 'Congress' from Twitter bio as crisis in Punjab worsens https://t.co/T8PRlAeXUE,https://www.republicworld.com/india-news/politics/capt-amarinder-singh-removes-congress-from-twitter-bio-as-crisis-in-punjab-worsens.html
Thu Sep 30 11:21:06 +0000 2021,"Afghanistan Crisis: After Taliban takeover, airline industry sees loss of around $7m https://t.co/M5rRQMvV9J",https://www.republicworld.com/world-news/rest-of-the-world-news/afghanistan-crisis-after-taliban-takeover-airline-industry-sees-loss-of-around-7m.html
Thu Sep 30 11:20:24 +0000 2021,Tunisia names Najla Bouden Romdhane as country's first ever female prime minister https://t.co/IwAlUUryol,https://www.republicworld.com/world-news/africa/tunisia-names-najla-bouden-romdhane-as-countrys-first-ever-female-prime-minister.html
Thu Sep 30 11:19:48 +0000 2021,'I empathise...': Captain Amarinder's sweet reply to Indian footballer Amrinder over chaos https://t.co/SQFldd3x6C,https://www.republicworld.com/india-news/general-news/i-empathise-dot-captain-amarinders-sweet-reply-to-indian-footballer-amrinder-over-chaos.html
Thu Sep 30 11:14:27 +0000 2021,"'Capt Amarinder Singh is such a senior leader, he shouldn't have been ignored. Attack on Kapil Sibal deplorable, it… https://t.co/8f6YPWx313",https://twitter.com/i/web/status/1443534704888610821
Thu Sep 30 11:07:10 +0000 2021,#BREAKING | Violent clashes between TMC cadre and BJP workers in Bhabanipur as polling is underway in the constitue… https://t.co/OraDllmzR0,https://twitter.com/i/web/status/1443532871075909637
Thu Sep 30 11:04:24 +0000 2021,TMC and BJP engage in a violent clash in Bhabanipur on polling day in a highly contested by-election between Priyan… https://t.co/wGRE4ibFuH,https://twitter.com/i/web/status/1443532174762803202
Thu Sep 30 11:04:24 +0000 2021,"Congress will soon resolve issues with Sidhu, says Cabinet Min Pargat Singh amid crisis https://t.co/YCp7bAYw5y",https://www.republicworld.com/india-news/politics/congress-will-soon-resolve-issues-with-sidhu-says-cabinet-min-pargat-singh-amid-crisis.html
Thu Sep 30 11:02:13 +0000 2021,#BREAKING | Clashes in Bhabanipur as by-election is underway in the constituency. Watch #LIVE updates here… https://t.co/oXTNUeH1Ro,https://twitter.com/i/web/status/1443531623228530688
Thu Sep 30 11:01:24 +0000 2021,"Sidhu accuses Punjab DGP of wrongfully indicting 2 Sikhs, giving clean chit to Badals https://t.co/oi5SEeR0x9",https://www.republicworld.com/india-news/politics/sidhu-accuses-punjab-dgp-of-wrongfully-indicting-2-sikhs-giving-clean-chit-to-badals.html
Thu Sep 30 10:57:29 +0000 2021,Pakistan police baton charges students demonstrating against flawed online entrance exam https://t.co/2aFVqrZ4kY,https://www.republicworld.com/world-news/pakistan-news/pakistan-police-baton-charges-students-demonstrating-against-flawed-online-entrance-exam.html
Thu Sep 30 10:53:20 +0000 2021,Will Punjab CM Charanjit Channi &amp; Navjot Sidhu come to conclusion? Will Channi succeed in convincing Sidhu? Will Si… https://t.co/089rnu9PfC,https://twitter.com/i/web/status/1443529389870702592
Thu Sep 30 10:46:15 +0000 2021,"Punjab Police Constable answer key 2021 released, raise objections by Oct 1

https://t.co/3ittGwaFNN",https://www.republicworld.com/india-news/education/punjab-police-constable-answer-key-2021-re1leased-raise-objections-by-oct-1.html
Thu Sep 30 10:43:32 +0000 2021,SRH vs CSK: Hayden calls Dhoni MVP of IPL 2021; 'he has the reigns &amp; he is cracking them' https://t.co/mQFLnR79nX,https://www.republicworld.com/sports-news/cricket-news/srh-vs-csk-hayden-calls-dhoni-mvp-of-ipl-2021-he-has-the-reigns-and-he-is-cracking-them.html
Thu Sep 30 10:41:02 +0000 2021,Navjot Sidhu's meeting with Punjab CM Charanjit Channi underway; Captain Amarinder Singh enroute Chandigarh after h… https://t.co/W8bTFIKGly,https://twitter.com/i/web/status/1443526295522983943
Thu Sep 30 10:30:41 +0000 2021,'Pause in Israeli settlement activity in Palestine region must be permanent': UN envoy https://t.co/GWGNZPYTTY,https://www.republicworld.com/world-news/rest-of-the-world-news/pause-in-israeli-settlement-activity-in-palestine-region-must-be-permanent-un-envoy.html
Thu Sep 30 10:27:32 +0000 2021,IAF Chief RKS Bhadauria retires after 42 years of service; Air Marshal Chaudhari new chief https://t.co/ojaDcvUuqT,https://www.republicworld.com/india-news/general-news/iaf-chief-rks-bhadauria-retires-after-42-years-of-service-air-marshal-chaudhari-new-chief.html
Thu Sep 30 10:26:01 +0000 2021,"Why India needs to enhance and modernise its defence sector, Maj Gen GD Bakshi (Retd.) explains in the 2nd episode… https://t.co/OVtN0G8tuX",https://twitter.com/i/web/status/1443522516215951366
Thu Sep 30 10:24:19 +0000 2021,#BREAKING | Captain Amarinder Singh arrives at Delhi Airport to leave for Chandigarh after his crucial Delhi visit… https://t.co/4lou51YPvK,https://twitter.com/i/web/status/1443522086383742979
Thu Sep 30 10:21:48 +0000 2021,Punjab Crisis LIVE Updates: Amarinder says he's quitting Congress but not joining BJP https://t.co/8Gfr4OFqbC,https://www.republicworld.com/india-news/politics/punjab-crisis-live-updates-amarinder-says-hes-quitting-congress-but-not-joining-bjp.html
Thu Sep 30 10:17:32 +0000 2021,India's goalkeeper Amrinder Singh pleads to 'stop tagging' him in posts about ex-Punjab CM https://t.co/spm1YFLHf3,https://www.republicworld.com/sports-news/football-news/indias-goalkeeper-amrinder-singh-pleads-to-stop-tagging-him-in-posts-about-ex-punjab-cm.html
Thu Sep 30 09:54:17 +0000 2021,Manish Tewari shames masterminds of Congress protest &amp; vandalism at Kapil Sibal's house https://t.co/MW8GqR8xmd,https://www.republicworld.com/india-news/politics/manish-tewari-shames-masterminds-of-congress-protest-and-vandalism-at-kapil-sibals-house.html
Thu Sep 30 09:44:54 +0000 2021,"Australian PM hails India as a 'great friend', hopes for a stronger energy partnership https://t.co/rZOCWEVSX3",https://www.republicworld.com/world-news/australia/australian-pm-hails-india-as-a-great-friend-hopes-for-a-stronger-energy-partnership.html
Thu Sep 30 09:33:05 +0000 2021,"#BREAKING | ‘Leaving Congress, but not joining BJP’: Captain Amarinder Singh issues statement, says ‘senior leaders… https://t.co/6HgpuKbhNH",https://twitter.com/i/web/status/1443509193508474884
Thu Sep 30 09:30:32 +0000 2021,Joe Biden looking forward to work with new Japan PM to boost bilateral ties: White House https://t.co/LTv62jbQPh,https://www.republicworld.com/world-news/us-news/joe-biden-looking-forward-to-work-with-new-japan-pm-to-boost-bilateral-ties-white-house.html
Thu Sep 30 09:28:46 +0000 2021,Supreme Court talks tough on farm stir; asks 'How can highways be blocked perpetually?' https://t.co/KPQv5moQ5m,https://www.republicworld.com/india-news/law-and-order/supreme-court-talks-tough-on-farm-stir-asks-how-can-highways-be-blocked-perpetually.html
Thu Sep 30 09:27:57 +0000 2021,"Delhi court warns TMC MP Abhishek Banerjee's wife, Rujira after she skips summon  https://t.co/IY7PucUXVo",https://www.republicworld.com/india-news/general-news/delhi-court-warns-tmc-mp-abhishek-banerjees-wife-rujira-after-she-skips-summon.html
Thu Sep 30 09:27:42 +0000 2021,Punjab 2022 polls | Akali Dal scoffs at Kejriwal's free healthcare claim: 'Hindi translation of SAD promises' https://t.co/jQRVyMYIzJ,https://www.republicworld.com/india-news/politics/akali-dal-scoffs-at-kejriwals-free-healthcare-claim-hindi-translation-of-sad-promises.html
Thu Sep 30 09:20:46 +0000 2021,#LIVE | AAP leaders remain tight-lipped on Navjot Singh Sidhu over possibilities of his inclusion in party amid Con… https://t.co/K5lpW9afNK,https://twitter.com/i/web/status/1443506095792668674
Thu Sep 30 09:17:09 +0000 2021,"Congress' Natwar Singh slams party high command led by Gandhis, wishes them 'good luck' https://t.co/dZe60t6gbe",https://www.republicworld.com/india-news/politics/congress-natwar-singh-slams-party-high-command-led-by-gandhis-wishes-them-good-luck.html
Thu Sep 30 09:16:10 +0000 2021,"Congress a vehicle without driver, Sidhu 'unstable': MoS Ajay Kumar Mishra https://t.co/hj9g2OoVMt",https://www.republicworld.com/india-news/politics/congress-a-vehicle-without-driver-sidhu-unstable-mos-ajay-kumar-mishra.html
Thu Sep 30 09:15:52 +0000 2021,Akhilesh Yadav meets kin of Kanpur trader killed in police raid; demands judicial probe https://t.co/SskqrufWht,https://www.republicworld.com/india-news/politics/akhilesh-yadav-meets-kin-of-kanpur-trader-killed-in-police-raid-demands-judicial-probe.html
Thu Sep 30 09:11:20 +0000 2021,"Dibrugarh University Results 2021 of 6th semester out, here's direct link to check https://t.co/QB0iU6ZT9y",https://www.republicworld.com/india-news/education/dibrugarh-university-results-2021-of-6th-semester-out-heres-direct-link-to-check.html
Thu Sep 30 09:11:00 +0000 2021,Nepal includes 'other' category in census; LGBTQ community upset over lack of specifics https://t.co/0Qpz4Of9Bp,https://www.republicworld.com/world-news/rest-of-the-world-news/nepal-includes-other-category-in-census-lgbtq-community-upset-over-lack-of-specifics.html
Thu Sep 30 09:06:28 +0000 2021,"World No 1 Novak Djokovic pulls out of Indian Wells after US Open loss, apologises to fans https://t.co/9RmBZ5njk8",https://www.republicworld.com/sports-news/tennis-news/world-no-1-novak-djokovic-pulls-out-of-indian-wells-after-us-open-loss-apologises-to-fans.html
Thu Sep 30 09:06:23 +0000 2021,CM Yogi Adityanath orders dismissal of UP policemen involved in crime: 'No place for such people' https://t.co/GNBDbWFMaH,https://www.republicworld.com/india-news/general-news/cm-yogi-orders-dismissal-of-up-policemen-involved-in-crime-no-place-for-such-people.html
Thu Sep 30 09:03:27 +0000 2021,Sushant Singh Rajput Case: Late actor's absconding friend Kunal Jani arrested by NCB https://t.co/BClBpKe56h,https://www.republicworld.com/entertainment-news/bollywood-news/sushant-singh-rajput-case-late-actors-absconding-friend-kunal-jani-arrested-by-ncb.html
Thu Sep 30 08:45:44 +0000 2021,Joe Biden administration to issue memo to terminate Trump-era Migrant Protection Protocols https://t.co/NyoWf3fxYh,https://www.republicworld.com/world-news/us-news/joe-biden-administration-to-issue-memo-to-terminate-trump-era-migrant-protection-protocols.html
Thu Sep 30 08:42:48 +0000 2021,Olympic medalist Rupinder Pal Singh announces retirement from international hockey at 30 https://t.co/yI4ud08jIa,https://www.republicworld.com/sports-news/hockey-news/olympic-medalist-rupinder-pal-singh-announces-retirement-from-international-hockey-at-30.html
Thu Sep 30 08:40:51 +0000 2021,Congress infighting grows as AICC secretary Imran Masood lauds SP's prospects for UP polls https://t.co/lIQOlDkTGL,https://www.republicworld.com/india-news/politics/congress-infighting-grows-as-aicc-secretary-imran-masood-lauds-sps-prospects-for-up-polls.html
