time,text,url
Mon Sep 27 10:52:54 +0000 2021,Dilip Ghosh alleges 'plot to murder' after he was attacked while campaigning for BJP's candidate Priyanka Tibrewal… https://t.co/gLSLXvDKQ4,https://twitter.com/i/web/status/1442442115821170696
Mon Sep 27 10:51:03 +0000 2021,'Every party has constitutional right to campaign but we have been attacked on multiple occasions': BJP's Dilip Gho… https://t.co/W5yn89vrl7,https://twitter.com/i/web/status/1442441649435525129
Mon Sep 27 10:48:46 +0000 2021,#BREAKING | Dilip Ghosh addresses press conference after being attacked in Bhabanipore which is slated for bypoll o… https://t.co/0dtdxSJuTO,https://twitter.com/i/web/status/1442441075113684999
Mon Sep 27 10:45:57 +0000 2021,#BREAKING | Pune Police conducted raids at various locations with regards to IPL betting; recovered cash over Rs 92… https://t.co/sUAwVYOGqh,https://twitter.com/i/web/status/1442440367408779267
Mon Sep 27 10:40:07 +0000 2021,#BharatBandhChaos | Civilians in distress due to 'Bharat Bandh' call by farm laws protestors. Watch here… https://t.co/4lWWwWWgoM,https://twitter.com/i/web/status/1442438898601234438
Mon Sep 27 10:38:04 +0000 2021,"Kerala SET Result 2021 announced, here is how to download the scorecards https://t.co/x63bnzNuD3",https://www.republicworld.com/india-news/education/kerala-set-result-2021-announced-here-is-how-to-download-the-scorecards.html
Mon Sep 27 10:34:19 +0000 2021,Left workers vandalise the Broadband office of a news channel in Kozhikode as part of the Harthal that was called t… https://t.co/l70aOWKDcr,https://twitter.com/i/web/status/1442437440380104707
Mon Sep 27 10:27:24 +0000 2021,"US, allies looking for 'Plan B' to stop Iranian nuclear programme: Israeli Diplomat https://t.co/v9X44xuRPS",https://www.republicworld.com/world-news/rest-of-the-world-news/us-allies-looking-for-plan-b-to-stop-iranian-nuclear-programme-israeli-diplomat.html
Mon Sep 27 10:18:49 +0000 2021,Japan to get first-ever woman Prime Minister? Two top contenders in the fray https://t.co/Km56rqJoA4,https://www.republicworld.com/world-news/rest-of-the-world-news/japan-to-get-first-ever-woman-prime-minister-two-top-contenders-in-the-fray.html
Mon Sep 27 10:18:11 +0000 2021,"Rajasthan BSTC Result 2021 declared, candidates can click on direct link to check the same https://t.co/ejFXFeK5qm",https://www.republicworld.com/india-news/education/rajasthan-bstc-result-2021-declared-heres-direct-link-to-check.html
Mon Sep 27 09:47:54 +0000 2021,Maharashtra: BJP withdraws RS bypoll candidate days after Fadnavis-Thorat meet https://t.co/4TlPZrb3xM,https://www.republicworld.com/india-news/politics/maharashtra-bjp-withdraws-rs-bypoll-candidate-days-after-fadnavis-thorat-meet.html
Mon Sep 27 09:46:58 +0000 2021,"Protestors block railway tracks at Delhi, Ambala &amp; Firozpur divisions; Train ops affected https://t.co/vkn2glu6k5",https://www.republicworld.com/india-news/city-news/protestors-block-railway-tracks-at-delhi-ambala-and-firozpur-divisions-train-ops-affected.html
Mon Sep 27 09:42:54 +0000 2021,"Elon Musk explains source of inspiration to explore space in interview, answer goes viral https://t.co/oFD7TTZgAL",https://www.republicworld.com/entertainment-news/whats-viral/elon-musk-explains-source-of-inspiration-to-explore-space-in-interview-answer-goes-viral.html
Mon Sep 27 09:41:19 +0000 2021,"COVID: Australia plans int'l border reopening, Sydney to lift lockdown curbs as cases fall https://t.co/SBBpal3XJj",https://www.republicworld.com/world-news/australia/covid-australia-plans-intl-border-reopening-sydney-to-lift-lockdown-curbs-as-cases-fall.html
Mon Sep 27 09:36:03 +0000 2021,Sudan's Empowerment Removal Committee condemns withdrawal of security forces from HQ sites https://t.co/z3sunQYTOM,https://www.republicworld.com/world-news/africa/sudans-empowerment-removal-committee-condemns-withdrawal-of-security-forces-from-hq-sites.html
Mon Sep 27 09:34:26 +0000 2021,REET 2021: Five arrested for cheating with help of bluetooth device kept in chappal https://t.co/nRsFcIUmZP,https://www.republicworld.com/india-news/education/reet-2021-five-arrested-for-cheating-with-help-of-bluetooth-device-kept-in-chappal.html
Mon Sep 27 09:29:17 +0000 2021,NASA's Landsat-9 Earth-observing satellite to launch on Sept 27 from California coast https://t.co/p07AkgZLFK,https://www.republicworld.com/technology-news/science/nasas-landsat-9-earth-observing-satellite-to-launch-on-sept-27-from-california-coast.html
Mon Sep 27 09:24:45 +0000 2021,Rohini court firing: Delhi HC to hear plea seeking enhanced security in district courts https://t.co/ZOgGS09tsD,https://www.republicworld.com/india-news/law-and-order/rohini-court-firing-delhi-hc-to-hear-plea-seeking-enhanced-security-in-district-courts.html
Mon Sep 27 09:21:17 +0000 2021,"Bharat Bandh: Clashes erupt as protestors break barricades, breach security in Noida https://t.co/NsE1yx5JWq",https://www.republicworld.com/india-news/general-news/bharat-bandh-clashes-erupt-as-protestors-break-barricades-breach-security-in-noida.html
Mon Sep 27 09:19:06 +0000 2021,World Tourism Day: Union Min Anurag Thakur avers India can become hub of religious tourism https://t.co/FK6r9cxHMd,https://www.republicworld.com/india-news/general-news/world-tourism-day-union-min-anurag-thakur-avers-india-can-become-hub-of-religious-tourism.html
Mon Sep 27 09:11:21 +0000 2021,#BREAKING | BJP National Vice President Dilip Ghosh speaks exclusively to Republic TV after he was attacked during… https://t.co/Zl79EXYHC6,https://twitter.com/i/web/status/1442416562112135171
Mon Sep 27 09:09:55 +0000 2021,"Karnataka: 60-year-old building collapses in Bengaluru, no casualties reported https://t.co/gYjs7b9ek1",https://www.republicworld.com/india-news/city-news/karnataka-60-year-old-building-collapses-in-bengaluru-no-casualties-reported.html
Mon Sep 27 09:03:27 +0000 2021,Supreme Court gives 4 months to TNSEC to complete urban local body polls in Tamil Nadu   https://t.co/WReDCVNhAH,https://www.republicworld.com/india-news/law-and-order/supreme-court-gives-4-months-to-tnsec-to-complete-urban-local-body-polls-in-tamil-nadu.html
Mon Sep 27 09:03:23 +0000 2021,"Moeen Ali rues lack of batting opportunities in Test cricket, says 'I was wasted' https://t.co/hNMp3H13wj",https://www.republicworld.com/sports-news/cricket-news/moeen-ali-rues-lack-of-batting-opportunities-in-test-cricket-says-i-was-wasted.html
Mon Sep 27 08:53:57 +0000 2021,"Muraleedharan slams Kerala CM for backing Bharat Bandh, calls CPI-M 'enemy of development' https://t.co/sDEqFXUwk3",https://www.republicworld.com/india-news/politics/muraleedharan-slams-kerala-cm-for-backing-bharat-bandh-calls-cpi-m-enemy-of-development.html
Mon Sep 27 08:47:30 +0000 2021,"Indian Coast Guard Admit Card 2021 released for Navik, Yantrik exams; Here's direct link https://t.co/AZ0LMnA2v2",https://www.republicworld.com/india-news/education/indian-coast-guard-admit-card-2021-released-for-navik-yantrik-exams-heres-direct-link.html
Mon Sep 27 08:40:12 +0000 2021,"Over 84.50 cr Covid vaccine doses provided to states, UTs: Centre https://t.co/e4972GEvqU",https://www.republicworld.com/india-news/general-news/over-84-dot-50-cr-covid-vaccine-doses-provided-to-states-uts-centre.html
Mon Sep 27 08:40:09 +0000 2021,"Mayawati lashes out at BJP, says UP Cabinet extension aimed at mobilising caste votes https://t.co/d5TsLV36vl",https://www.republicworld.com/india-news/politics/mayawati-lashes-out-at-bjp-says-up-cabinet-extension-aimed-at-mobilising-caste-votes.html
Mon Sep 27 08:40:07 +0000 2021,"Bhabanipur bypoll: BJP and TMC workers clash on last day of campaign, Dilip Ghosh attacked https://t.co/Ka2F1hSEge",https://www.republicworld.com/india-news/politics/bhabanipur-bypoll-bjp-and-tmc-workers-clash-on-last-day-of-campaign-dilip-ghosh-attacked.html
Mon Sep 27 08:32:39 +0000 2021,EAM Jaishankar discusses Indo-Pacific developments with Singapore's FM Vivian Balakrishnan https://t.co/wOSs5turTe,https://www.republicworld.com/india-news/politics/eam-jaishankar-discusses-indo-pacific-developments-with-singapores-fm-vivian-balakrishnan.html
Mon Sep 27 08:29:55 +0000 2021,"Moeen Ali retires from Test Cricket, hopes to inspire British Muslims to join England team https://t.co/zvzbs2ExOQ",https://www.republicworld.com/sports-news/cricket-news/moeen-ali-retires-from-test-cricket-hopes-to-inspire-british-muslims-to-join-england-team.html
Mon Sep 27 08:25:47 +0000 2021,"Arvind Kejriwal backs Bharat Bandh call, asks Centre to repeal the 3 Farm Laws https://t.co/Q7wHfzr6MH",https://www.republicworld.com/india-news/politics/arvind-kejriwal-backs-bharat-bandh-call-asks-centre-to-repeal-the-3-farm-laws.html
Mon Sep 27 08:23:30 +0000 2021,"BKU's Bhanu Pratap Singh lashes out at Rakesh Tikait, asks how Bharat Bandh will benefit https://t.co/iXcy1dI11C",https://www.republicworld.com/india-news/general-news/bkus-bhanu-pratap-singh-lashes-out-at-rakesh-tikait-asks-how-bharat-bandh-will-benefit.html
Mon Sep 27 08:14:57 +0000 2021,Tamil Nadu: Protesters clash with police on Bharat Bandh in Chennai's Anna Salai area https://t.co/NeWhAe4tCt,https://www.republicworld.com/india-news/general-news/tamil-nadu-protesters-clash-with-police-on-bharat-bandh-in-chennais-anna-salai-area.html
Mon Sep 27 07:57:37 +0000 2021,"Rahul Gandhi, Priyanka support SKM's Bharat Bandh call, term Centre 'exploitative' https://t.co/KL3eJsKD7w",https://www.republicworld.com/india-news/politics/rahul-gandhi-priyanka-support-skms-bharat-bandh-call-term-centre-exploitative.html
Mon Sep 27 07:57:04 +0000 2021,Hundreds protest outside UN headquarters over women's rights violations in Afghanistan https://t.co/C1TgXV04JB,https://www.republicworld.com/world-news/rest-of-the-world-news/hundreds-protest-outside-un-headquarters-over-womens-rights-violations-in-afghanistan.html
Mon Sep 27 07:50:49 +0000 2021,"Japan names China, Russia and N Korea as cyberspace threats who 'steal military info' https://t.co/ECI45YoUE1",https://www.republicworld.com/world-news/rest-of-the-world-news/japan-names-china-russia-and-n-korea-as-cyberspace-threats-who-steal-military-info.html
Mon Sep 27 07:50:24 +0000 2021,"Dombivli rape case: 1 more arrested, all 33 including 2 minors held by Thane Police https://t.co/zd30ESaa0O",https://www.republicworld.com/india-news/law-and-order/dombivli-rape-case-1-more-arrested-all-33-including-2-minors-held-by-thane-police.html
Mon Sep 27 07:47:43 +0000 2021,"Theoneste Bagosora, 'mastermind' of Rwanda genocide passes away at 80 https://t.co/evoJGMim7X",https://www.republicworld.com/world-news/africa/theoneste-bagosora-mastermind-of-rwanda-genocide-passes-away-at-80.html
Mon Sep 27 07:46:47 +0000 2021,IMD predicts heavy rains in Telangana for the next 24 hrs; issues flash flood warning https://t.co/AeuzVCp5AX,https://www.republicworld.com/india-news/general-news/imd-predicts-heavy-rains-in-telangana-for-the-next-24-hrs-issues-flash-flood-warning.html
Mon Sep 27 07:37:49 +0000 2021,"England all-rounder Moeen Ali retires from Test cricket ahead of Ashes campaign

https://t.co/r1XNOmu6G9",https://www.republicworld.com/sports-news/cricket-news/englands-moeen-ali-to-retire-from-test-cricket-nations-ashes-campaign-receives-blow.html
Mon Sep 27 07:36:10 +0000 2021,"British fuel crisis leads to chaos, blocked roads as people throng to petrol pumps https://t.co/Lz0GJtrdKP",https://www.republicworld.com/world-news/uk-news/british-fuel-crisis-leads-to-chaos-blocked-roads-as-people-throng-to-petrol-pumps.html
Mon Sep 27 07:35:44 +0000 2021,Maharashtra FYJC admission 2021: First-come-first-served round begins tomorrow https://t.co/gYp74Rj71q,https://www.republicworld.com/india-news/education/maharashtra-fyjc-admission-2021-first-come-first-served-round-begins-tomorrow.html
Mon Sep 27 07:35:11 +0000 2021,"PM Modi launches Ayushman Bharat Digital Mission, health sector gets massive boost https://t.co/2Ty5J8J79e",https://www.republicworld.com/india-news/general-news/pm-modi-launches-ayushman-bharat-digital-mission-health-sector-gets-massive-boost.html
Mon Sep 27 07:34:11 +0000 2021,Former Goa CM Luizinho Faleiro quits Congress; praises Mamata amid rumours of joining TMC https://t.co/zQhMtIuFbS,https://www.republicworld.com/india-news/politics/former-goa-cm-luizinho-faleiro-quits-congress-praises-mamata-amid-rumours-of-joining-tmc.html
Mon Sep 27 07:30:38 +0000 2021,Mahant Narendra Giri's death: Court grants 5-day police custody of accused to CBI https://t.co/mK5yaDPSZQ,https://www.republicworld.com/india-news/general-news/mahant-narendra-giris-death-court-grants-5-day-police-custody-of-accused-to-cbi.html
Mon Sep 27 07:26:44 +0000 2021,Octopus in a shell: South Carolina resident shares rare experience on social media  https://t.co/yTDjtiuCAo,https://www.republicworld.com/world-news/us-news/octopus-in-a-shell-south-carolina-resident-shares-rare-experience-on-social-media.html
Mon Sep 27 07:19:58 +0000 2021,"IPL 2021, RCB vs MI: List of records broken during match in Dubai, check highlights https://t.co/rwtEduU8IL",https://www.republicworld.com/sports-news/cricket-news/ipl-2021-rcb-vs-mi-list-of-records-broken-during-match-in-dubai-check-highlights.html
Mon Sep 27 07:16:21 +0000 2021,#IPL2021: Virat Kohli narrates masterplan that led to Pollard and Hardik's dismissals https://t.co/vqeJyu8GhV,https://www.republicworld.com/sports-news/cricket-news/ipl-2021-virat-kohli-narrates-masterplan-that-led-to-pollard-and-hardiks-dismissals.html
Mon Sep 27 07:09:28 +0000 2021,COVID-19:  Activists refute Turkmenistan's claim of recording 'zero case' since pandemic outbreak https://t.co/nmwgMpIZ2k,https://www.republicworld.com/world-news/rest-of-the-world-news/activists-refute-turkmenistans-claim-of-recording-zero-case-since-pandemic-outbreak.html
Mon Sep 27 07:08:50 +0000 2021,NIA to investigate death of tribal leader Athuan Abonmai: Manipur Home Dept https://t.co/KUzRJtj4EE,https://www.republicworld.com/india-news/law-and-order/nia-to-investigate-death-of-tribal-leader-athuan-abonmai-manipur-home-dept.html
Mon Sep 27 07:08:14 +0000 2021,"Bihar Board Inter Admissions 2021: Third merit list to be released today, see details https://t.co/EUbaweLyMf",https://www.republicworld.com/india-news/education/bihar-board-inter-admissions-2021-third-merit-list-to-be-released-today-see-details.html
Mon Sep 27 07:07:41 +0000 2021,IND W vs AUS W: Jhulan Goswami hits winning boundary to seal crushing win https://t.co/uDCd4OXFPL,https://www.republicworld.com/sports-news/cricket-news/ind-w-vs-aus-w-jhulan-goswami-hits-winning-boundary-to-seal-crushing-win.html
Mon Sep 27 07:02:09 +0000 2021,"Naomi Osaka provides an update on her return amid disappointing form, read details https://t.co/OK1Q7oiQhA",https://www.republicworld.com/sports-news/tennis-news/naomi-osaka-provides-an-update-on-her-return-amid-disappointing-form-read-details.html
Mon Sep 27 06:58:50 +0000 2021,"COVID-19: 26,041 new infections reported in India; Kerala sees 15,951 cases https://t.co/XzfoPrcK65",https://www.republicworld.com/india-news/general-news/covid-19-26041-new-infections-reported-in-india-kerala-sees-15951-cases.html
Mon Sep 27 06:55:21 +0000 2021,Rakesh Tikait apologises for traffic jam due to 'Bharat bandh'; reminds farmers' struggles https://t.co/jdgcXgOOmP,https://www.republicworld.com/india-news/general-news/rakesh-tikait-apologises-for-traffic-jam-due-to-bharat-bandh-reminds-farmers-struggles.html
Mon Sep 27 06:52:26 +0000 2021,"NASA, Boeing assist Russia in probing to find cause of cracks in ISS module https://t.co/EkutJvMmgc",https://www.republicworld.com/technology-news/science/nasa-boeing-assist-russia-in-probing-to-find-cause-of-cracks-in-iss-module.html
Mon Sep 27 06:49:53 +0000 2021,"BBAU Admit Card 2021 released for UG and PG entrance exams, see how to download https://t.co/AEYaHrpCwN",https://www.republicworld.com/india-news/education/bbau-admit-card-2021-released-for-ug-and-pg-entrance-exams-see-how-to-download.html
Mon Sep 27 06:43:10 +0000 2021,"IPL 2021: Betting racket busted in Indore, five bookies sent to police custody https://t.co/QLBbYQ2kw9",https://www.republicworld.com/india-news/general-news/ipl-2021-betting-racket-busted-in-indore-five-bookies-sent-to-police-custody.html
Mon Sep 27 06:42:01 +0000 2021,"Inox, PVR shares hit 52-week high, rally up to 18% as theatres to reopen in Maharashtra https://t.co/JMTZKWmV6r",https://www.republicworld.com/business-news/india-business/inox-pvr-shares-hit-52-week-high-rally-up-to-18-percent-as-theatres-to-reopen-in-maharashtra.html
Mon Sep 27 06:39:06 +0000 2021,Sania Mirza clinches 43rd WTA title at Ostrava Open with Shuai Zhang in women's doubles https://t.co/5CjxbdHInV,https://www.republicworld.com/sports-news/tennis-news/sania-mirza-clinches-43rd-wta-title-at-ostrava-open-with-shuai-zhang-in-womens-doubles.html
Mon Sep 27 06:34:43 +0000 2021,Cristiano Ronaldo promises Man Utd will 'get back on its feet' after defeat to Aston Villa https://t.co/jm5UEk2BVn,https://www.republicworld.com/sports-news/football-news/cristiano-ronaldo-promises-man-utd-will-get-back-on-its-feet-after-defeat-to-aston-villa.html
Mon Sep 27 06:31:19 +0000 2021,ED grills Samajwadi Party's Azam Khan in connection with money laundering case https://t.co/im2krV3Ld5,https://www.republicworld.com/india-news/general-news/ed-grills-samajwadi-partys-azam-khan-in-connection-with-money-laundering-case.html
Mon Sep 27 06:28:38 +0000 2021,"IPL 2021, SRH vs RR: Will David Warner find place in SRH playing XI? https://t.co/N7aa3fvois",https://www.republicworld.com/sports-news/cricket-news/ipl-2021-srh-vs-rr-will-david-warner-find-place-in-srh-playing-xi.html
Mon Sep 27 06:25:59 +0000 2021,Kareena Kapoor shares video of duo dancing to Diljit's Dosanjh's 'Black And White'  https://t.co/fySEKoec7l,https://www.republicworld.com/entertainment-news/bollywood-news/kareena-kapoor-shares-video-of-duo-dancing-to-diljits-dosanjhs-black-and-white.html
Mon Sep 27 06:21:26 +0000 2021,"DAVV CET 2021 result declared, here's direct link to download scorecards https://t.co/vplX1DZgK6",https://www.republicworld.com/india-news/education/davv-cet-2021-result-declared-heres-direct-link-to-download-scorecards.html
Mon Sep 27 06:18:59 +0000 2021,"Darrang firing: 2 arrested with PFI links, accused of 'mobilizing crowds' for protest https://t.co/5g2EqNm4Xc",https://www.republicworld.com/india-news/general-news/darrang-firing-2-arrested-with-pfi-links-accused-of-mobilizing-crowds-for-protest.html
Mon Sep 27 06:14:34 +0000 2021,'Break and win': Shiv Sena accuses Owaisi of splitting Muslim votes to let BJP win in UP https://t.co/RbChhYRVGa,https://www.republicworld.com/india-news/politics/break-and-win-shiv-sena-accuses-owaisi-of-splitting-muslim-votes-to-let-bjp-win-in-up.html
Mon Sep 27 06:07:43 +0000 2021,"Diesel prices increase in India, petrol rate remains steady; check fuel rates on Sept 27 https://t.co/yFscCfVc7o",https://www.republicworld.com/india-news/general-news/diesel-prices-increase-in-india-petrol-rate-remains-steady-check-fuel-rates-on-sept-27.html
Mon Sep 27 06:07:15 +0000 2021,Bharat Bandh: Protesters block highways; Delhi-Gurugram border sees massive traffic jam  https://t.co/JnlIziEXCH,https://www.republicworld.com/india-news/general-news/bharat-bandh-protesters-block-highways-delhi-gurugram-border-sees-massive-traffic-jam.html
Mon Sep 27 06:03:12 +0000 2021,UN Chief Antonio Guterres calls for ‘comprehensive elimination’ of nuclear weapons https://t.co/1S8ksstV9k,https://www.republicworld.com/world-news/rest-of-the-world-news/un-chief-antonio-guterres-calls-for-comprehensive-elimination-of-nuclear-weapons.html
Mon Sep 27 05:57:17 +0000 2021,"Union Min Narendra Singh Tomar asks farmers to quit agitation, engage in talks with govt https://t.co/YayQR0TXcw",https://www.republicworld.com/india-news/politics/union-min-narendra-singh-tomar-asks-farmers-to-quit-agitation-engage-in-talks-with-govt.html
Mon Sep 27 05:54:45 +0000 2021,"#BREAKING | PM Narendra Modi launches Ayushman Bharat Digital Mission, to include a health identity card for every… https://t.co/UCSqa4Bl1r",https://twitter.com/i/web/status/1442367084906696707
Mon Sep 27 05:53:53 +0000 2021,"India, Uzbekistan to hold 'close, periodic talks' over situation in Afghanistan https://t.co/hwKY8Snsho",https://www.republicworld.com/world-news/rest-of-the-world-news/india-uzbekistan-to-hold-close-periodic-talks-over-situation-in-afghanistan.html
Mon Sep 27 05:45:19 +0000 2021,"#WATCH | Unprecedent chaos as protesters block highways, rail track as part of the 'Bharat Bandh' call. Tune in for… https://t.co/Ni53qL9FFV",https://twitter.com/i/web/status/1442364709374611457
Mon Sep 27 05:37:18 +0000 2021,"Biden plan seeks to expand education, from pre-K to college https://t.co/93Lb1d4dcZ",https://www.republicworld.com/world-news/us-news/biden-plan-seeks-to-expand-education-from-pre-k-to-college.html
Mon Sep 27 05:34:16 +0000 2021,Akhilesh Yadav scoffs at BJP's last-minute UP cabinet expansion; calls it 'drama' https://t.co/O3BCPcd4OF,https://www.republicworld.com/india-news/politics/akhilesh-yadav-scoffs-at-bjps-last-minute-up-cabinet-expansion-calls-it-drama.html
Mon Sep 27 05:31:30 +0000 2021,"Republic Top 10 Headlines: Bharat Bandh, Mars Probe completes 7 yrs, Goa polls and more https://t.co/6iyqeczo6O",https://www.republicworld.com/world-news/rest-of-the-world-news/republic-top-10-headlines-bharat-bandh-mars-probe-completes-7-yrs-goa-polls-and-more.html
Mon Sep 27 05:21:46 +0000 2021,India emerges as Dubai's second biggest trade partner after China for H1 2021 https://t.co/xmhJzfY4H8,https://www.republicworld.com/india-news/general-news/india-emerges-as-dubais-second-biggest-trade-partner-after-china-for-h1-2021.html
Mon Sep 27 05:20:58 +0000 2021,PoK activists in London protest against Pakistan FM Shah Mahmood Qureshi's arrival in UK https://t.co/BiUA3Y7MeK,https://www.republicworld.com/world-news/uk-news/pok-activists-in-london-protest-against-pakistan-fm-shah-mahmood-qureshis-arrival-in-uk.html
Mon Sep 27 05:17:38 +0000 2021,WHO to revive probe into COVID-19 origin with new team of scientists: Report https://t.co/w58LHCE4gP,https://www.republicworld.com/world-news/rest-of-the-world-news/who-to-revive-probe-into-covid-19-origin-with-new-team-of-scientists-report.html
Mon Sep 27 05:12:21 +0000 2021,#ExtremeRules Extreme Rules 2021: Roman Reigns retains WWE Universal title against Finn Balor https://t.co/TVX9nHDciC,https://www.republicworld.com/sports-news/other-sports/extreme-rules-2021-roman-reigns-retains-wwe-universal-title-against-finn-balor.html
Mon Sep 27 05:11:53 +0000 2021,"AB de Villiers' son punches chair after father's dismissal, hurts hand | WATCH https://t.co/u4nauEARHg",https://www.republicworld.com/sports-news/cricket-news/ab-de-villiers-son-punches-chair-after-fathers-dismissal-hurts-hand-watch.html
Mon Sep 27 05:09:15 +0000 2021,"Cyclone Gulab completes landfall process in AP &amp; Odisha, turns into deep depression: IMD https://t.co/AXYERG8sF2",https://www.republicworld.com/india-news/general-news/cyclone-gulab-completes-landfall-process-in-ap-and-odisha-turns-into-deep-depression-imd.html
Mon Sep 27 05:05:31 +0000 2021,"Securing 25.7 per cent votes in the end-of-era elections in Germany, the Social Democrat Party was declared the win… https://t.co/OGyE1OQrM2",https://twitter.com/i/web/status/1442354693066215426
Mon Sep 27 04:45:12 +0000 2021,Suvendu Adhikari hits back at TMC's claim of Mamata being more popular than PM Modi https://t.co/wWAFrT12S7,https://www.republicworld.com/india-news/politics/suvendu-adhikari-hits-back-at-tmcs-claim-of-mamata-being-more-popular-than-pm-modi.html
Mon Sep 27 04:44:07 +0000 2021,"#WATCH | Bharat Bandh: Traffic movement severely disrupted in Delhi, Gurugram, Noida 

Tune in to watch #LIVE here… https://t.co/SQuaxgNQ4y",https://twitter.com/i/web/status/1442349307001065476
Mon Sep 27 04:39:14 +0000 2021,"Biden, Congress face big week for agenda, government funding https://t.co/DUSLH2Q3OE",https://www.republicworld.com/world-news/us-news/biden-congress-face-big-week-for-agenda-government-funding.html
Mon Sep 27 04:32:10 +0000 2021,Plastic waste chemical recycling industry could open gate to ‘circular economy’: Study https://t.co/91s9ulG21Q,https://www.republicworld.com/world-news/rest-of-the-world-news/plastic-waste-chemical-recycling-industry-could-open-gate-to-circular-economy-study.html
Mon Sep 27 04:30:52 +0000 2021,"iOS 15 new feature: How do Background Sounds in iOS15 work, step-by-step guide https://t.co/8NaVamIYKJ",https://www.republicworld.com/technology-news/how-to/ios-15-new-feature-how-do-background-sounds-in-ios15-work-step-by-step-guide.html
Mon Sep 27 04:24:09 +0000 2021,"WATCH: India puts China &amp; Pakistan on notice with mega defence boost 

https://t.co/jepQO0kqpW",https://www.youtube.com/watch?v=Rnv_Ytv6M4Q&t=105s
Mon Sep 27 04:20:58 +0000 2021,"Lewis Hamilton pens emotional post after winning 100th F1 race, thanks Mercedes teammates https://t.co/J38YY6a6yY",https://www.republicworld.com/sports-news/other-sports/lewis-hamilton-pens-emotional-post-after-winning-100th-f1-race-thanks-mercedes-teammates.html
Mon Sep 27 04:20:25 +0000 2021,"'Matter of right': CJI Ramana says India needs 50% women representation in judiciary

https://t.co/0IPPW6ae3P",https://www.republicworld.com/india-news/law-and-order/matter-of-right-cji-ramana-says-india-needs-50-percent-women-representation-in-judiciary.html
Mon Sep 27 04:18:51 +0000 2021,"#IPL2021PointsTable Update: Top Teams On Points Table, Latest Orange &amp; Purple Cap Race https://t.co/EWTtFypq2I",https://www.republicworld.com/sports-news/cricket-news/ipl-2021-points-table-update-top-teams-on-points-table-latest-orange-and-purple-cap-race.html
Mon Sep 27 04:16:27 +0000 2021,Ashok Gehlot's brother Agrasen summoned by ED in connection to fertilizer scam https://t.co/GcjrX11ugK,https://www.republicworld.com/india-news/general-news/ashok-gehlots-brother-agrasen-summoned-by-ed-in-connection-to-fertilizer-scam.html
