time,text,url
Mon Oct 04 12:26:16 +0000 2021,"#NationWithNCB | Aryan Khan and 2 others sent to NCB Custody till October 7

For #LIVE updates, click below https://t.co/csUbCbVt5x",https://www.republicworld.com/india-news/law-and-order/mumbai-drug-cases-live-updates-aryan-khan-arbaaz-merchantt-detained-over-alleged-rave-party.html
Mon Oct 04 12:18:37 +0000 2021,"#BREAKING on #NationWithNCB | Aryan Khan, Arbaaz Merchant and Munmun Dhamecha sent to NCB's custody till October 7… https://t.co/5SGRS2IECM",https://twitter.com/i/web/status/1445000404614324226
Mon Oct 04 12:17:03 +0000 2021,DU Admissions 2021 under first cut-off list begins today; Here's direct link to apply  https://t.co/Lod4vd5T3M,https://www.republicworld.com/india-news/education/du-admissions-2021-under-first-cut-off-list-begins-today-heres-direct-link-to-apply.html
Mon Oct 04 12:16:09 +0000 2021,"#NationWithNCB | Court about to pronounce order on Aryan Khan bail hearing. Click below for #LIVE updates
https://t.co/csUbCbVt5x",https://www.republicworld.com/india-news/law-and-order/mumbai-drug-cases-live-updates-aryan-khan-arbaaz-merchantt-detained-over-alleged-rave-party.html
Mon Oct 04 12:12:06 +0000 2021,#NationWithNCB | Court dictating its order on Aryan Khan's custody; Tune in for #LIVE updates on NCB's cruise ship… https://t.co/J5K6Ix3mBP,https://twitter.com/i/web/status/1444998763307802630
Mon Oct 04 12:09:16 +0000 2021,#NationWithNCB | Standby for court's order on Aryan Khan bail hearing; stay tuned to Republic here… https://t.co/lgGYFSbiMm,https://twitter.com/i/web/status/1444998051614105601
Mon Oct 04 12:04:44 +0000 2021,"What's happening in Lakhimpur Kheri as it becomes the epicentre of political chaos in Uttar Pradesh?

Watch here https://t.co/xParZSF8Ju",http://www.youtube.com/watch?v=WEYO-h5cRlg
Mon Oct 04 11:57:16 +0000 2021,#NationWithNCB | NCB Zonal Director Sameer Wankhede replies in the affirmative when asked by judge if custody of Ar… https://t.co/9ipUwZstLc,https://twitter.com/i/web/status/1444995028279971843
Mon Oct 04 11:50:11 +0000 2021,"#NationWithNCB | In hearing on Aryan Khan's custody, NCB Zonal Director Sameer Wankhede asked to provide informatio… https://t.co/hlV6GFTzKO",https://twitter.com/i/web/status/1444993248485724160
Mon Oct 04 11:49:29 +0000 2021,Russia may call UNSC meeting to seek report on US-led coalition's conduct in Afghanistan https://t.co/b8ftmWLARp,https://www.republicworld.com/world-news/rest-of-the-world-news/russia-may-call-unsc-meeting-to-seek-report-on-us-led-coalitions-conduct-in-afghanistan.html
Mon Oct 04 11:46:30 +0000 2021,#NationWithNCB | Public Prosecutor argues on behalf of NCB; says there were chats of bulk purchases of drugs; Watch… https://t.co/Y443PUuU0Y,https://twitter.com/i/web/status/1444992319145525251
Mon Oct 04 11:33:17 +0000 2021,#NationWithNCB | NCB Remand Copy states 'incriminating material found through WhatsApp chats' of the accused in the… https://t.co/4N8pYRGRTQ,https://twitter.com/i/web/status/1444988992873697282
Mon Oct 04 11:28:44 +0000 2021,#NationWithNCB | Marathon hearing ongoing in Mumbai's Killa court as NCB seeks custody of Aryan Khan after arrest i… https://t.co/Snq6YSTDDT,https://twitter.com/i/web/status/1444987850118742016
Mon Oct 04 11:21:31 +0000 2021,Republic accesses NCB remand copy of the accused in Mumbai cruise drug bust case; Watch fast-paced developments… https://t.co/OHNWtxA4UX,https://twitter.com/i/web/status/1444986031632171009
Mon Oct 04 11:20:55 +0000 2021,India's Foreign Secy meets Sri Lanka's PM; discusses boosting multifaceted partnership https://t.co/FSBKoVnpKR,https://www.republicworld.com/world-news/rest-of-the-world-news/indias-foreign-secy-meets-sri-lankas-pm-discusses-boosting-multifaceted-partnership.html
Mon Oct 04 11:19:17 +0000 2021,#BREAKING | Aryan Khan distances himself from the drug bust; lawyer Satish Maneshinde argues against NCB's plea for… https://t.co/H93TQIBYBx,https://twitter.com/i/web/status/1444985470635622402
Mon Oct 04 11:13:55 +0000 2021,#NationWithNCB | NCB seeks custody of Aryan Khan till October 11; lawyers for other accused arguing in court; Tune… https://t.co/gLViedrxJI,https://twitter.com/i/web/status/1444984119050395651
Mon Oct 04 11:06:13 +0000 2021,Republic tracking minute-by-minute updates of the Mumbai cruise drug bust case as Aryan Khan and other accused are… https://t.co/TZKELV0n0H,https://twitter.com/i/web/status/1444982180967600131
Mon Oct 04 11:02:59 +0000 2021,"IIT Madras launches two diplomas courses in Programming and Data Science, details here https://t.co/3XcZk8WZLA",https://www.republicworld.com/india-news/education/iit-madras-launches-two-diplomas-courses-in-programming-and-data-science-details-here.html
Mon Oct 04 10:56:30 +0000 2021,#NationWithNCB | Aryan Khan produced before Mumbai's Killa court; tune in for #LIVE updates of arguments from both… https://t.co/qiGPisNVNc,https://twitter.com/i/web/status/1444979736678047753
Mon Oct 04 10:52:25 +0000 2021,"Swedish artist Lars Vilks, threatened for artworks of the Prophet, dies in car crash https://t.co/6DWom18Rwm",https://www.republicworld.com/world-news/europe/swedish-artist-lars-vilks-threatened-for-artworks-of-the-prophet-dies-in-car-crash.html
Mon Oct 04 10:49:16 +0000 2021,"What are the charges against Aryan Khan in NCB's Mumbai Cruise Drug Bust? 

Watch here https://t.co/8WvyhhRS61",http://youtube.com/watch?v=xck-xo90Maw
Mon Oct 04 10:45:43 +0000 2021,NEET SS 2021: NBE urges SC to defer exam to January to give more time to candidates https://t.co/2eXLwh45DL,https://www.republicworld.com/india-news/education/neet-ss-2021-nbe-urges-sc-to-defer-exam-to-january-to-give-more-time-to-candidates.html
Mon Oct 04 10:30:29 +0000 2021,Taliban reveals 40% of historical sites in Afghanistan's Herat region require restoration https://t.co/TRKJkM6q3E,https://www.republicworld.com/world-news/rest-of-the-world-news/taliban-reveals-40-percent-of-historical-sites-in-afghanistans-herat-region-require-restoration.html
Mon Oct 04 10:26:56 +0000 2021,"Lakhimpur violence: Congress workers, Priyanka Vadra, Sidhu detained for staging protests https://t.co/qDe7WBzTbw",https://www.republicworld.com/india-news/politics/lakhimpur-violence-congress-workers-priyanka-vadra-sidhu-detained-for-staging-protests.html
Mon Oct 04 10:21:22 +0000 2021,70% of India's adult population administered first dose of COVID vaccine: Centre https://t.co/fHnDQ1X04J,https://www.republicworld.com/india-news/general-news/70-percent-of-indias-adult-population-administered-first-dose-of-covid-vaccine-centre.html
Mon Oct 04 10:15:17 +0000 2021,#BREAKING | NCB seeks further custody to unearth the entire drug nexus; cites WhatsApp chats and discussion of cash… https://t.co/vqFG5EUhad,https://twitter.com/i/web/status/1444969364072144896
Mon Oct 04 10:13:38 +0000 2021,2021 Nobel Prize in Medicine: David Julius &amp; Ardem Patapoutian's Receptors discovery wins https://t.co/YpHIX5DXZo,https://www.republicworld.com/world-news/rest-of-the-world-news/2021-nobel-prize-in-medicine-david-julius-and-ardem-patapoutians-receptors-discovery-wins.html
Mon Oct 04 10:09:24 +0000 2021,"#BREAKING | While Aryan Khan's lawyer seeks bail, NCB seeks further custody; Republic tracking #LIVE updates from i… https://t.co/tHlvzXhYU3",https://twitter.com/i/web/status/1444967885168861187
Mon Oct 04 10:02:17 +0000 2021,#BREAKING | Aryan Khan's bail plea hearing underway at Killa Court; Aryan Khan's lawyer allowed to speak to Aryan;… https://t.co/GmGNXnw5P6,https://twitter.com/i/web/status/1444966093056008197
Mon Oct 04 10:00:13 +0000 2021,Shakti Sinha - Former bureaucrat &amp; close-aide of Atal Bihari Vajpayee - passes away https://t.co/kKWmH8lqQD,https://www.republicworld.com/india-news/general-news/shakti-sinha-former-bureaucrat-and-close-aide-of-atal-bihari-vajpayee-passes-away.html
Mon Oct 04 09:54:15 +0000 2021,#BREAKING | 9 accused to be produced in the court in connection with Mumbai Cruise Drug Bust; NCB likely to seek fu… https://t.co/zsf0bVrz6F,https://twitter.com/i/web/status/1444964071955222528
Mon Oct 04 09:52:19 +0000 2021,"Inside Cordelia Cruise: Events that Led to Aryan Khan's arrest | How NCB Busted The Rave Party

https://t.co/FHv1NTCYEX",https://www.youtube.com/watch?v=o-j5WUTxTTU
Mon Oct 04 09:47:16 +0000 2021,"NIACL AO Admit Card 2021 released, here's direct link to download hall tickets https://t.co/W5ZXgpgiWl",https://www.republicworld.com/india-news/education/niacl-ao-admit-card-2021-released-heres-direct-link-to-download-hall-tickets.html
Mon Oct 04 09:45:01 +0000 2021,"TS PGECET Counselling 2021: Registration begins today, here's how to register https://t.co/OysnCJFg72",https://www.republicworld.com/india-news/education/ts-pgecet-counselling-2021-registration-begins-today-heres-how-to-register.html
Mon Oct 04 09:43:02 +0000 2021,#BREAKING | Aryan Khan to be produced at Killa court in connection with the drug bust. Watch #LIVE updates here… https://t.co/THjVxuV5ie,https://twitter.com/i/web/status/1444961247649275907
Mon Oct 04 09:37:22 +0000 2021,"UP TET 2021 notification to be released today, registration begins on October 7 https://t.co/D7f0FcPK4p",https://www.republicworld.com/india-news/education/up-tet-2021-notification-to-be-released-today-registration-begins-on-october-7.html
Mon Oct 04 09:34:59 +0000 2021,SC dismisses plea seeking modification on order to raze the two 40-storey towers in Noida https://t.co/hHVttee2b3,https://www.republicworld.com/india-news/law-and-order/sc-dismisses-plea-seeking-modification-on-order-to-raze-the-two-40-storey-towers-in-noida.html
Mon Oct 04 09:34:50 +0000 2021,"UPI's transaction value on course to reach $1 trillion annually, affirms Ashwini Vaishnaw https://t.co/YtsdOS2yAD",https://www.republicworld.com/technology-news/other-tech-news/upis-transaction-value-on-course-to-reach-1-dollars-trillion-annually-affirms-ashwini-vaishnaw.html
Mon Oct 04 09:27:19 +0000 2021,"SC issues notice to 43 farmer bodies, asks 'why protest on street when laws are in court' https://t.co/E8nU2ugip9",https://www.republicworld.com/india-news/law-and-order/sc-issues-notice-to-43-farmer-bodies-asks-why-protest-on-street-when-laws-are-in-court.html
Mon Oct 04 09:25:55 +0000 2021,"IPL 2021 DC vs CSK live streaming: How to watch IPL 2021 in India, UK &amp; US? https://t.co/bIsQnWOUrI",https://www.republicworld.com/sports-news/cricket-news/ipl-2021-dc-vs-csk-live-streaming-how-to-watch-ipl-2021-in-india-uk-and-us.html
Mon Oct 04 09:24:11 +0000 2021,Tamil Nadu CM MK Stalin writes to CMs of 12 states about reviving education https://t.co/34aXNu6Mfv,https://www.republicworld.com/india-news/education/tamil-nadu-cm-mk-stalin-writes-to-cms-of-12-states-about-reviving-education.html
Mon Oct 04 09:07:13 +0000 2021,NEET 2021 Phase 2 registration begins; Here's direct link to apply https://t.co/rMxaKfGOMS,https://www.republicworld.com/india-news/education/neet-2021-phase-2-registration-begins-heres-direct-link-to-apply.html
Mon Oct 04 08:59:02 +0000 2021,NBA COVID-19 rules explained: What are the rules for vaccinated and unvaccinated players? https://t.co/qu0iXhJUd3,https://www.republicworld.com/sports-news/other-sports/nba-covid-19-rules-explained-what-are-the-rules-for-vaccinated-and-unvaccinated-players.html
Mon Oct 04 08:52:34 +0000 2021,Delhi HC issues notice to AAP and Centre on plea against 1968 Civil Defence Act https://t.co/1lRArZ9UaI,https://www.republicworld.com/india-news/law-and-order/delhi-hc-issues-notice-to-aap-and-centre-on-plea-against-1968-civil-defence-act.html
Mon Oct 04 08:51:57 +0000 2021,"DC vs CSK Dream11 Prediction: Head to head, top picks, team news, and more https://t.co/mZcHDIR5uL",https://www.republicworld.com/sports-news/cricket-news/dc-vs-csk-dream11-prediction-head-to-head-top-picks-team-news-and-more.html
Mon Oct 04 08:43:32 +0000 2021,Lakhimpur Kheri violence: Akali Dal demands legal action against Ajay Mishra's son https://t.co/qAiP3cm326,https://www.republicworld.com/india-news/politics/lakhimpur-kheri-violence-akali-dal-demands-legal-action-against-ajay-mishras-son.html
Mon Oct 04 08:40:44 +0000 2021,Navjot Sidhu detained by police for staging protest over Lakhimpur violence in Chandigarh https://t.co/LJidB4hx5o,https://www.republicworld.com/india-news/politics/navjot-sidhu-detained-by-police-for-staging-protest-over-lakhimpur-violence-in-chandigarh.html
Mon Oct 04 08:38:34 +0000 2021,NEET 2021 cancellation plea dismissed: SC says 'Lakhs of students can't be made to suffer' https://t.co/IK58jxARR6,https://www.republicworld.com/india-news/education/neet-2021-cancellation-plea-dismissed-sc-says-lakhs-of-students-cant-be-made-to-suffer.html
Mon Oct 04 08:33:20 +0000 2021,"Lakhimpur violence: Police-farmer breakthrough; ex-gratia, jobs &amp; judge-led probe ordered https://t.co/Z504SpkpeE",https://www.republicworld.com/india-news/general-news/lakhimpur-violence-police-farmer-breakthrough-ex-gratia-jobs-and-judge-led-probe-ordered.html
Mon Oct 04 08:30:49 +0000 2021,West Bengal post-poll violence: HC raps govt for delay in giving compensation to victims https://t.co/oxnR4lU1j5,https://www.republicworld.com/india-news/law-and-order/west-bengal-post-poll-violence-hc-raps-govt-for-delay-in-giving-compensation-to-victims.html
Mon Oct 04 08:29:54 +0000 2021,Facebook whistleblower Frances Haugen alleges tech giant picked profit over public safety https://t.co/yQurvstmIv,https://www.republicworld.com/world-news/us-news/facebook-whistleblower-frances-haugen-alleges-tech-giant-picked-profit-over-public-safety.html
Mon Oct 04 08:26:51 +0000 2021,"Lakhimpur violence: Ajay Mishra denies charges against his son, calls them 'baseless' https://t.co/tISjV5p5te",https://www.republicworld.com/india-news/politics/lakhimpur-violence-ajay-mishra-denies-charges-against-his-son-calls-them-baseless.html
Mon Oct 04 08:26:13 +0000 2021,"JEE Advanced 2021: Question papers out for Physics, Chemistry &amp; Math, here's direct link https://t.co/02I8LD8uQU",https://www.republicworld.com/india-news/education/jee-advanced-2021-question-papers-out-for-physics-chemistry-and-math-heres-direct-link.html
Mon Oct 04 08:24:47 +0000 2021,CM Arvind Kejriwal announces 10-point 'winter action plan' to curb pollution in Delhi https://t.co/Be6DhWWOQA,https://www.republicworld.com/india-news/general-news/cm-arvind-kejriwal-announces-10-point-winter-action-plan-to-curb-pollution-in-delhi.html
Mon Oct 04 08:18:05 +0000 2021,Lakhimpur Kheri violence: Heavy traffic brings Delhi Noida Direct Flyway to a halt https://t.co/HFHOD1LMz4,https://www.republicworld.com/india-news/general-news/lakhimpur-kheri-violence-heavy-traffic-brings-delhi-noida-direct-flyway-to-a-halt.html
Mon Oct 04 08:08:09 +0000 2021,HSSC SI Answer Key 2021 released for female candidates; Raise objections till Oct 5 https://t.co/HzArYOLA4O,https://www.republicworld.com/india-news/education/hssc-si-answer-key-2021-released-for-female-candidates-raise-objections-till-oct-5.html
Mon Oct 04 07:59:51 +0000 2021,"Lakhimpur violence: Ashok Gehlot condemns detention of leaders in UP, hits out at BJP https://t.co/LvHt5j4DzJ",https://www.republicworld.com/india-news/politics/lakhimpur-violence-ashok-gehlot-condemns-detention-of-leaders-in-up-hits-out-at-bjp.html
Mon Oct 04 07:47:32 +0000 2021,"Fumio Kishida formally elected as 100th Prime Minister of Japan, to announce cabinet soon https://t.co/LtPDwzemUF",https://www.republicworld.com/world-news/rest-of-the-world-news/fumio-kishida-formally-elected-as-100th-prime-minister-of-japan-to-announce-cabinet-soon.html
Mon Oct 04 07:46:00 +0000 2021,"T20 World Cup: Jos Buttler confident 'England can win' without Ben Stokes, Jofra Archer https://t.co/lYxGful33n",https://www.republicworld.com/sports-news/cricket-news/t20-world-cup-jos-buttler-confident-england-can-win-without-ben-stokes-jofra-archer.html
Mon Oct 04 07:40:34 +0000 2021,"#LIVE | Youth Congress workers stage protest at UP Bhawan in New Delhi over Lakhimpur violence

Tune in to watch he… https://t.co/MMTzeYKrOG",https://twitter.com/i/web/status/1444930429644001281
Mon Oct 04 07:30:03 +0000 2021,"ATL Space Challenge 2021: CBSE, ISRO team up to mark World Space Week; Participate now https://t.co/2lu5QQUqxG",https://www.republicworld.com/india-news/education/atl-space-challenge-2021-cbse-isro-team-up-to-mark-world-space-week-participate-now.html
Mon Oct 04 07:25:23 +0000 2021,Lakhimpur-Kheri violence: SKM seeks President Kovind's intervention; puts forth demands https://t.co/R4YP3nOY1M,https://www.republicworld.com/india-news/general-news/lakhimpur-kheri-violence-skm-seeks-president-kovinds-intervention-puts-forth-demands.html
Mon Oct 04 07:23:05 +0000 2021,"DU Admissions 2021: Online application for DU college admission begins, here's everything you need to know https://t.co/LUJ7wQPlvi",https://www.republicworld.com/india-news/education/du-admissions-2021-online-application-for-du-college-admission-begins-heres-everything-you-need-to-know.html
Mon Oct 04 07:19:38 +0000 2021,"NCB continues searches on Cordelia Cruise ship, more passengers detained with drugs https://t.co/BcloQqouLW",https://www.republicworld.com/entertainment-news/bollywood-news/ncb-continues-searches-on-cordelia-cruise-ship-more-passengers-detained-with-drugs.html
Mon Oct 04 07:14:17 +0000 2021,Kerala HC quashes state govt order of reducing COVID-19 RTPCR test prices in private labs https://t.co/4p5yvn0NOT,https://www.republicworld.com/india-news/law-and-order/kerala-hc-quashes-state-govt-order-of-reducing-covid-19-rtpcr-test-prices-in-private-labs.html
Mon Oct 04 07:13:24 +0000 2021,"Lakhimpur Kheri violence: Yogi Adityanath holds emergency meeting, security stepped up https://t.co/mTo3jmpuwp",https://www.republicworld.com/india-news/general-news/lakhimpur-kheri-violence-yogi-adityanath-holds-emergency-meeting-security-stepped-up.html
Mon Oct 04 07:13:07 +0000 2021,"REET 2021: BJP MP Kirodi Lal Meena reiterates demand for REET cancellation, alleges paper leak https://t.co/VvYE2ClIVn",https://www.republicworld.com/india-news/education/reet-2021-bjp-mp-kirodi-lal-meena-reiterates-demand-for-reet-cancellation-alleges-paper-leak.html
Mon Oct 04 07:06:57 +0000 2021,"#BREAKING | NCB raids in Mumbai continue, more passengers detained with drugs on Cordelia cruise ship.

Tune in for… https://t.co/YauLjMvcxo",https://twitter.com/i/web/status/1444921969586049029
Mon Oct 04 07:05:32 +0000 2021,"IPL 2021: Know how KKR, PBKS, RR, &amp; MI can qualify for playoffs https://t.co/d9ZUpEbKGZ",https://www.republicworld.com/sports-news/cricket-news/ipl-2021-know-how-kkr-pbks-rr-and-mi-can-qualify-for-playoffs.html
Mon Oct 04 07:05:02 +0000 2021,Lakhimpur clash: Priyanka Gandhi protests detainment by UP police; sweeps PAC guest house https://t.co/cFZfVEWEJJ,https://www.republicworld.com/india-news/politics/lakhimpur-clash-priyanka-gandhi-protests-detainment-by-up-police-sweeps-pac-guest-house.html
Mon Oct 04 06:57:39 +0000 2021,"Lakhimpur Kheri violence | UP Govt denies permission to Channi's chopper, Dy CM lashes out https://t.co/Gm3tIlqEN0",https://www.republicworld.com/india-news/general-news/lakhimpur-kheri-violence-up-govt-denies-permission-to-channis-chopper-dy-cm-lashes-out.html
Mon Oct 04 06:54:24 +0000 2021,IPL 2021: Who is Umran Malik? Meet the youngster who clocked 150kmph on debut https://t.co/Uc3gR0SORA,https://www.republicworld.com/sports-news/cricket-news/ipl-2021-who-is-umran-malik-meet-the-youngster-who-clocked-150kmph-on-debut.html
Mon Oct 04 06:49:07 +0000 2021,Shiv Sena tears into BJP over Lakhimpur violence; draws comparison to British-era atrocity https://t.co/8Dn4IVGJ8Q,https://www.republicworld.com/india-news/politics/shiv-sena-tears-into-bjp-over-lakhimpur-violence-draws-comparison-to-british-era-atrocity.html
Mon Oct 04 06:47:44 +0000 2021,"WBJEE first round seat allotment result 2021 to be out today, check steps to download https://t.co/4r51kyBj8x",https://www.republicworld.com/india-news/education/wbjee-first-round-seat-allotment-result-2021-to-be-out-today-check-steps-to-download.html
Mon Oct 04 06:42:02 +0000 2021,"#LIVE | Arrested Aryan Khan, others taken out of the NCB Office. Tune in to watch the latest updates here -… https://t.co/mI7z4S4pjs",https://twitter.com/i/web/status/1444915699781029888
Mon Oct 04 06:40:04 +0000 2021,Chhattisgarh CM Baghel hits out at UP govt for barring him from entering Lucknow https://t.co/4ddL8tShR6,https://www.republicworld.com/india-news/politics/chhattisgarh-cm-baghel-hits-out-at-up-govt-for-barring-him-from-entering-lucknow.html
Mon Oct 04 06:31:26 +0000 2021,"CUCET Answer Key 2021 released, raise objections till Oct 5; see steps here https://t.co/I9QcrPMti6",https://www.republicworld.com/india-news/education/cucet-answer-key-2021-released-raise-objections-till-oct-5-see-steps-here.html
Mon Oct 04 06:31:09 +0000 2021,Lakhimpur Kheri violence: UP Minister says 'politicians running there for photo-ops' https://t.co/BlYw01iT4A,https://www.republicworld.com/india-news/politics/lakhimpur-kheri-violence-up-minister-says-politicians-running-there-for-photo-ops.html
Mon Oct 04 06:28:47 +0000 2021,"Denied entry to Lucknow, Chhattisgarh CM Bhupesh Baghel to visit camped MLAs in Delhi https://t.co/3jBnTJGzDO",https://www.republicworld.com/india-news/politics/denied-entry-to-lucknow-chhattisgarh-cm-bhupesh-baghel-to-visit-camped-mlas-in-delhi.html
Mon Oct 04 06:25:49 +0000 2021,"Aryan Khan arrest LIVE updates: Sameer Wankhede reaches Mumbai International Cruise terminal

https://t.co/csUbCbDRGX",https://www.republicworld.com/india-news/law-and-order/mumbai-drug-cases-live-updates-aryan-khan-arbaaz-merchantt-detained-over-alleged-rave-party.html
Mon Oct 04 06:20:23 +0000 2021,Ballon d'Or 2021: How can Manchester United's Cristiano Ronaldo win this year? https://t.co/1DY4RFJbSO,https://www.republicworld.com/sports-news/football-news/ballon-dor-2021-how-can-manchester-uniteds-cristiano-ronaldo-win-this-year.html
Mon Oct 04 06:16:33 +0000 2021,Petrol &amp; diesel prices remain constant after recent surge; check fuel rates on Oct 4 https://t.co/nXWD1JrgjT,https://www.republicworld.com/india-news/general-news/petrol-and-diesel-prices-remain-constant-after-recent-surge-check-fuel-rates-on-oct-4.html
Mon Oct 04 06:08:59 +0000 2021,"Lakhimpur violence LIVE updates: Punjab CM Charanjit Channi has sought to visit Lakhimpur-Kheri

https://t.co/k615UDe5j7",https://www.republicworld.com/india-news/general-news/up-lakhimpur-kheri-violence-news-live-updates.html
Mon Oct 04 06:01:38 +0000 2021,"CBSE compartment result 2021: Class 12 marks verification begins, check key dates here https://t.co/vD7EmyvAt2",https://www.republicworld.com/india-news/education/cbse-compartment-result-2021-class-12-marks-verification-begins-check-key-dates-here.html
Mon Oct 04 06:01:29 +0000 2021,"COVID-19: India reports 20,799 new cases, 180 deaths in 24 hours; recovery rate at 97.89% https://t.co/6x7mTNPJl3",https://www.republicworld.com/india-news/general-news/covid-19-india-reports-20799-new-cases-180-deaths-in-24-hours-recovery-rate-at-97-dot-89-percent.html
Mon Oct 04 05:54:09 +0000 2021,"BJP's Tathagata Roy congratulates Mamata on Bhabanipur win, avers 'she's my CM too' https://t.co/XNNXld3nqO",https://www.republicworld.com/india-news/politics/bjps-tathagata-roy-congratulates-mamata-on-bhabanipur-win-avers-shes-my-cm-too.html
Mon Oct 04 05:48:05 +0000 2021,"Lakhimpur violence: Varun Gandhi writes to CM; seeks CBI probe, murder charges on those who killed farmers https://t.co/jnHaXFLV0q",https://www.republicworld.com/india-news/politics/varun-gandhi-writes-to-cm-seeks-cbi-probe-murder-charges-on-those-who-killed-farmers.html
Mon Oct 04 05:39:23 +0000 2021,"DU Admissions 2021 for UG courses begins today, here's how to apply online https://t.co/pRneeCX6Ob",https://www.republicworld.com/india-news/education/du-admissions-2021-for-ug-courses-begins-today-heres-how-to-apply-online.html
Mon Oct 04 05:37:21 +0000 2021,"Lakhimpur violence: SP workers stage protest, Akhilesh Yadav demands Misra's resignation https://t.co/cGuGdfublr",https://www.republicworld.com/india-news/politics/lakhimpur-violence-sp-workers-stage-protest-akhilesh-yadav-demands-misras-resignation.html
Mon Oct 04 05:17:28 +0000 2021,"Lakhimpur violence LIVE updates: Sec 144 imposed; SP chief taken into preventive custody

https://t.co/k615UDe5j7",https://www.republicworld.com/india-news/general-news/up-lakhimpur-kheri-violence-news-live-updates.html
Mon Oct 04 05:15:39 +0000 2021,"T20 World Cup: Check ticket prices, match dates and how to buy them online https://t.co/sbAtY3yKYy",https://www.republicworld.com/sports-news/cricket-news/t20-world-cup-check-ticket-prices-match-dates-and-how-to-buy-them-online.html
Mon Oct 04 05:12:48 +0000 2021,Lakhimpur violence: Rahul Gandhi backs sister Priyanka Vadra after her detainment: 'They are scared of you' https://t.co/HpOivFjZDP,https://www.republicworld.com/india-news/politics/rahul-gandhi-backs-sister-priyanka-vadra-after-her-detainment-they-are-scared-of-you.html
Mon Oct 04 05:11:28 +0000 2021,Yogi Adityanath cancels scheduled visit to UP districts as tensions escalate in Lakhimpur https://t.co/wYYzDMfDYj,https://www.republicworld.com/india-news/politics/yogi-adityanath-cancels-scheduled-visit-to-up-districts-as-tensions-escalate-in-lakhimpur.html
Mon Oct 04 05:09:33 +0000 2021,"#LIVE | Akhilesh Yadav detained from outside his residence after police stopped him from going to Lakhimpur Kheri,… https://t.co/eLzf6lcW6M",https://twitter.com/i/web/status/1444892423495159810
Mon Oct 04 05:02:03 +0000 2021,"Jhulan Goswami, Ellyse Perry's camaraderie after match is what sportsmanship is all about https://t.co/oPoWDk7ngh",https://www.republicworld.com/sports-news/cricket-news/jhulan-goswami-ellyse-perrys-camaraderie-after-match-is-what-sportsmanship-is-all-about.html
